### ISSUE TITLE
Malformed JWT token crashes CouchDB 3.2.0

### ISSUE THREAD

**Issue by ig3** [apache/couchdb#3976]
[NOTE]: # ( ^^ Provide a general summary of the issue in the title above. ^^ )

## Description

Sending a request with a malformed JWT token in Authorization header causes CouchDB to crash and restart.

I was trying out JWT authentication and my first attempt was with a malformed JWT token. Subsequent tests with good tokens work as expected and various other token errors are handled without crashing and with appropriate error responses and logs.

## Steps to Reproduce

```
curl -v http://localhost:5984/test \
  -H "Accept: application/json" \
  -H "Content-Type: application/json; charset=utf-8" \
  -H "Authorization: Bearer eyJhbGciOiJIUzI1NiIsInR5cCI6IkpXVCIsImtpZCI6ImZvbyJ9.eyJraWQiOiJmb28iLCJzdWIiOiJhZG1pbiIsIm5hbWUiOiJhZG1pbiIsInJvbGVzIjpbInRlc3QxIiwidGVzdDIiXX0=.xftH2byj7LV9/YqqacmyZfcxQt+/h0etsgtRj6aL4AE="
```

## Expected Behaviour

Request fails with an error and the server does not crash.

## Your Environment

[TIP]:  # ( Include as many relevant details about your environment as possible. )
[TIP]:  # ( You can paste the output of curl http://YOUR-COUCHDB:5984/ here. )

* CouchDB version used: 3.2.0 compiled from source on Debian Bullseye on x86_64 and armv7l
* Browser name and version: n/a: testing with curl and NodeJS based clients.
* Operating system and version: Debian Bullseye

## Additional Context

With each failed request there are two logs, similar to the following:

>Mar 29 13:15:45 tecra couchdb[108694]: [error] 2022-03-29T00:15:45.553476Z couchdb@127.0.0.1 <0.15259.2> -------- CRASH REPORT Process  (<0.15259.2>) with 0 neighbors crashed with reason: {invalid_ejson,{bad_block,88}} at jiffy:encode/2(line:99) <= couch_httpd:before_response/4(line:1207) <= couch_httpd:handle_response/5(line:1199) <= couch_httpd:send_response_no_cors/4(line:798) <= chttpd:process_request/1(line:318) <= chttpd:handle_request_int/1(line:249) <= mochiweb_http:headers/6(line:150) <= proc_lib:init_p_do_apply/3(line:226); initial_call: {mochiweb_acceptor,init,['Argument__1','Argument__2',...]}, ancestors: [chttpd,chttpd_sup,<0.352.0>], message_queue_len: 0, links: [<0.356.0>,#Port<0.44>], dictionary: [{couch_rewrite_count,0},{dont_log_response,true},{chttpd_stats,{st,...}},...], trap_exit: false, status: running, heap_size: 1598, stack_size: 28, reductions: 6583
>Mar 29 13:15:45 tecra couchdb[108694]: [error] 2022-03-29T00:15:45.553930Z couchdb@127.0.0.1 <0.15259.2> -------- CRASH REPORT Process  (<0.15259.2>) with 0 neighbors crashed with reason: {invalid_ejson,{bad_block,88}} at jiffy:encode/2(line:99) <= couch_httpd:before_response/4(line:1207) <= couch_httpd:handle_response/5(line:1199) <= couch_httpd:send_response_no_cors/4(line:798) <= chttpd:process_request/1(line:318) <= chttpd:handle_request_int/1(line:249) <= mochiweb_http:headers/6(line:150) <= proc_lib:init_p_do_apply/3(line:226); initial_call: {mochiweb_acceptor,init,['Argument__1','Argument__2',...]}, ancestors: [chttpd,chttpd_sup,<0.352.0>], message_queue_len: 0, links: [<0.356.0>,#Port<0.44>], dictionary: [{couch_rewrite_count,0},{dont_log_response,true},{chttpd_stats,{st,...}},...], trap_exit: false, status: running, heap_size: 1598, stack_size: 28, reductions: 6583

**Comment by big-r81** [comment]
Hi,

I can reproduce this on windows.

`[error] 2022-04-08T09:33:44.043000Z couchdb@localhost <0.5852.1> -------- CRASH REPORT Process  (<0.5852.1>) with 0 neighbors crashed with reason: {invalid_ejson,{bad_block,88}} at jiffy:encode/2(line:99) <= couch_httpd:before_response/4(line:1207) <= couch_httpd:handle_response/5(line:1199) <= couch_httpd:send_response_no_cors/4(line:798) <= chttpd:process_request/1(line:318) <= chttpd:handle_request_int/1(line:249) <= mochiweb_http:headers/6(line:150) <= proc_lib:init_p_do_apply/3(line:226); initial_call: {mochiweb_acceptor,init,['Argument__1','Argument__2',...]}, ancestors: [chttpd,chttpd_sup,<0.332.0>], message_queue_len: 0, links: [<0.336.0>,#Port<0.33>], dictionary: [{chttpd_stats,{st,0,0,0}},{dont_log_response,true},{dont_log_request,...},...], trap_exit: false, status: running, heap_size: 4185, stack_size: 28, reductions: 6665

[error] 2022-04-08T09:33:44.043000Z couchdb@localhost <0.5852.1> -------- CRASH REPORT Process  (<0.5852.1>) with 0 neighbors crashed with reason: {invalid_ejson,{bad_block,88}} at jiffy:encode/2(line:99) <= couch_httpd:before_response/4(line:1207) <= couch_httpd:handle_response/5(line:1199) <= couch_httpd:send_response_no_cors/4(line:798) <= chttpd:process_request/1(line:318) <= chttpd:handle_request_int/1(line:249) <= mochiweb_http:headers/6(line:150) <= proc_lib:init_p_do_apply/3(line:226); initial_call: {mochiweb_acceptor,init,['Argument__1','Argument__2',...]}, ancestors: [chttpd,chttpd_sup,<0.332.0>], message_queue_len: 0, links: [<0.336.0>,#Port<0.33>], dictionary: [{chttpd_stats,{st,0,0,0}},{dont_log_response,true},{dont_log_request,...},...], trap_exit: false, status: running, heap_size: 4185, stack_size: 28, reductions: 6665
`

Does your server completely die, so that you can't do any requests to it?

**Comment by ig3** [comment]
No, my server does not completely die. I am able to continue sending requests. I don't notice any unaccepted requests but there is no load on the server, just my testing.

I am running a single node.

There are four processes running:

```
couchdb   108694       1  3 Mar29 ?        09:07:04 /home/couchdb/couchdb/bin/../erts-11.1.8/bin/beam.smp -K true -A 16 -Bd -- -root /home/couchdb/couchdb/bin/.. -progname couchdb -- -home /home/couchdb -- -boot /home/couchdb/couchdb/bin/../releases/3.2.0/couchdb -name couchdb@127.0.0.1 -setcookie monster -kernel error_logger silent -sasl sasl_error_logger false -noshell -noinput -smp enable -ssl session_lifetime 300 -- -config /home/couchdb/couchdb/bin/../releases/3.2.0/sys.config --
couchdb   108724  108694  0 Mar29 ?        00:00:00 erl_child_setup 65536
couchdb   121212  108724  0 Mar29 ?        00:00:00 inet_gethost 4
couchdb   121213  121212  0 Mar29 ?        00:00:00 inet_gethost 4
couchdb   128655  108724  0 Mar30 ?        00:00:00 ./bin/couchjs ./share/server/main.js
```
After the 'CRASH', there is no change to the set of processes. Whatever is crashing, it is internal to CouchDB and not manifest at the operating system level as a process terminating and a new process being started.

My clients do not see a reply. For example, the tests with curl produce:

```
*   Trying ::1:5984...
* connect to ::1 port 5984 failed: Connection refused
*   Trying 127.0.0.1:5984...
* Connected to localhost (127.0.0.1) port 5984 (#0)
> GET /test HTTP/1.1
> Host: localhost:5984
> User-Agent: curl/7.74.0
> Accept: application/json
> Content-Type: application/json; charset=utf-8
> Authorization: Bearer eyJhbGciOiJIUzI1NiIsInR5cCI6IkpXVCIsImtpZCI6ImZvbyJ9.eyJraWQiOiJmb28iLCJzdWIiOiJhZG1pbiIsIm5hbWUiOiJhZG1pbiIsInJvbGVzIjpbInRlc3QxIiwidGVzdDIiXX0=.xftH2byj7LV9/YqqacmyZfcxQt+/h0etsgtRj6aL4AE=
> 
* Empty reply from server
* Connection #0 to host localhost left intact
curl: (52) Empty reply from server
```
At the network layer I see:

```
No.     Time           Source                Destination           Protocol Length Info
      1 0.000000000    ::1                   ::1                   TCP      94     39212 → 5984 [SYN] Seq=0 Win=65476 Len=0 MSS=65476 SACK_PERM=1 TSval=3974581731 TSecr=0 WS=128
      2 0.000004993    ::1                   ::1                   TCP      74     5984 → 39212 [RST, ACK] Seq=1 Ack=1 Win=0 Len=0
      3 0.000057414    127.0.0.1             127.0.0.1             TCP      74     58268 → 5984 [SYN] Seq=0 Win=65495 Len=0 MSS=65495 SACK_PERM=1 TSval=3683328382 TSecr=0 WS=128
      4 0.000063329    127.0.0.1             127.0.0.1             TCP      74     5984 → 58268 [SYN, ACK] Seq=0 Ack=1 Win=65483 Len=0 MSS=65495 SACK_PERM=1 TSval=3683328382 TSecr=3683328382 WS=128
      5 0.000068053    127.0.0.1             127.0.0.1             TCP      66     58268 → 5984 [ACK] Seq=1 Ack=1 Win=65536 Len=0 TSval=3683328382 TSecr=3683328382
      6 0.000123111    127.0.0.1             127.0.0.1             HTTP     422    GET /test HTTP/1.1
      7 0.000141033    127.0.0.1             127.0.0.1             TCP      66     5984 → 58268 [ACK] Seq=1 Ack=357 Win=65152 Len=0 TSval=3683328382 TSecr=3683328382
      8 0.000641134    127.0.0.1             127.0.0.1             TCP      66     5984 → 58268 [FIN, ACK] Seq=1 Ack=357 Win=65536 Len=0 TSval=3683328383 TSecr=3683328382
      9 0.000779854    127.0.0.1             127.0.0.1             TCP      66     58268 → 5984 [FIN, ACK] Seq=357 Ack=2 Win=65536 Len=0 TSval=3683328383 TSecr=3683328383
     10 0.000785487    127.0.0.1             127.0.0.1             TCP      66     5984 → 58268 [ACK] Seq=2 Ack=358 Win=65536 Len=0 TSval=3683328383 TSecr=3683328383
```
So the TCP connection is promptly reset by the server, without sending any response.

But I am able to send another request immediately after:

```
$ bash testLocal.sh; bash testLocal.sh
*   Trying ::1:5984...
* connect to ::1 port 5984 failed: Connection refused
*   Trying 127.0.0.1:5984...
* Connected to localhost (127.0.0.1) port 5984 (#0)
> GET /test HTTP/1.1
> Host: localhost:5984
> User-Agent: curl/7.74.0
> Accept: application/json
> Content-Type: application/json; charset=utf-8
> Authorization: Bearer eyJhbGciOiJIUzI1NiIsInR5cCI6IkpXVCIsImtpZCI6ImZvbyJ9.eyJraWQiOiJmb28iLCJzdWIiOiJhZG1pbiIsIm5hbWUiOiJhZG1pbiIsInJvbGVzIjpbInRlc3QxIiwidGVzdDIiXX0=.xftH2byj7LV9/YqqacmyZfcxQt+/h0etsgtRj6aL4AE=
> 
* Empty reply from server
* Connection #0 to host localhost left intact
curl: (52) Empty reply from server
*   Trying ::1:5984...
* connect to ::1 port 5984 failed: Connection refused
*   Trying 127.0.0.1:5984...
* Connected to localhost (127.0.0.1) port 5984 (#0)
> GET /test HTTP/1.1
> Host: localhost:5984
> User-Agent: curl/7.74.0
> Accept: application/json
> Content-Type: application/json; charset=utf-8
> Authorization: Bearer eyJhbGciOiJIUzI1NiIsInR5cCI6IkpXVCIsImtpZCI6ImZvbyJ9.eyJraWQiOiJmb28iLCJzdWIiOiJhZG1pbiIsIm5hbWUiOiJhZG1pbiIsInJvbGVzIjpbInRlc3QxIiwidGVzdDIiXX0=.xftH2byj7LV9/YqqacmyZfcxQt+/h0etsgtRj6aL4AE=
> 
* Empty reply from server
* Connection #0 to host localhost left intact
curl: (52) Empty reply from server
```

That second request is not really immediately after, but as fast as my system can run a bash shell and instance of curl. The script has nothing in it but the curl command.

**Comment by big-r81** [comment]
@davisp Would you like to take a look please - you are the jiffy expert 😉

**Comment by davisp** [comment]
@big-r81 This isn't a jiffy issue really. Jiffy is just saying that it got passed something that's not encodable as JSON, namely `{bad_block, 88}` and then nothing catches the error before blowing up the socket.

Likely we just need to format that error into something that can be reported better. I'm not super familiar with the JWT code, maybe @rnewson or @nickva would have a better idea on where to start looking for that.

**Comment by rnewson** [comment]
heh, it's actually simpler. jwtf _does_ catch the error and throws {bad_request, Reason}. This would cause a 400 bad request. Unfortunately the reason from jiffy is not a binary (it's `{bad_block,88}` as above) and so we fail to generate the response body.
